{
  "schema_version": "1.0.0",
  "repository_info": {
    "url": "git@github.com:jackypanster/tetris-web.git",
    "commit_sha": "f649bc842d03038d8130c59a5f34d00b7a85d32b",
    "primary_language": "typescript",
    "analysis_timestamp": "2025-09-29 01:48:39.651530",
    "metrics_source": "submission.json"
  },
  "evaluation_result": {
    "checklist_items": [
      {
        "id": "code_quality_lint",
        "name": "Static Linting Passed",
        "dimension": "code_quality",
        "max_points": 15,
        "description": "Lint/static analysis pipeline covers core rules and passes successfully",
        "evaluation_status": "unmet",
        "score": 0.0,
        "evidence_references": [
          {
            "source_type": "file_check",
            "source_path": "$.metrics.code_quality.lint_results.passed",
            "description": "Checked lint_results.passed: expected True, got False",
            "confidence": 0.85,
            "raw_data": "False"
          },
          {
            "source_type": "file_check",
            "source_path": "$.metrics.code_quality.lint_results.tool_used",
            "description": "Checked lint_results.tool_used: should not be none, got none",
            "confidence": 0.85,
            "raw_data": "none"
          },
          {
            "source_type": "file_check",
            "source_path": "$.metrics.code_quality.lint_results.lint_results.issues_count < 10",
            "description": "Checked existence of lint_results.issues_count < 10",
            "confidence": 0.9,
            "raw_data": "null"
          },
          {
            "source_type": "file_check",
            "source_path": "$.metrics",
            "description": "Criteria not satisfied for 'met' or 'partial' status",
            "confidence": 0.8,
            "raw_data": "Evaluation criteria failed"
          }
        ]
      },
      {
        "id": "code_quality_build",
        "name": "Build/Package Success",
        "dimension": "code_quality",
        "max_points": 10,
        "description": "Provides recent build or package success log/CI record",
        "evaluation_status": "unmet",
        "score": 0.0,
        "evidence_references": [
          {
            "source_type": "file_check",
            "source_path": "$.metrics.code_quality.build_success",
            "description": "Checked build_success: expected True, got None",
            "confidence": 0.85,
            "raw_data": "None"
          },
          {
            "source_type": "file_check",
            "source_path": "$.metrics.code_quality.build_success",
            "description": "Checked build_success: expected None, got None",
            "confidence": 0.95,
            "raw_data": "None"
          },
          {
            "source_type": "file_check",
            "source_path": "$.metrics.code_quality.build_success.other quality indicators present",
            "description": "Checked existence of other quality indicators present",
            "confidence": 0.9,
            "raw_data": "null"
          },
          {
            "source_type": "file_check",
            "source_path": "$.metrics",
            "description": "Criteria not satisfied for 'met' or 'partial' status",
            "confidence": 0.8,
            "raw_data": "Evaluation criteria failed"
          }
        ]
      },
      {
        "id": "code_quality_security",
        "name": "Dependency Security Scan",
        "dimension": "code_quality",
        "max_points": 8,
        "description": "Executes dependency security scan, lists high-risk items with handling plan",
        "evaluation_status": "unmet",
        "score": 0.0,
        "evidence_references": [
          {
            "source_type": "file_check",
            "source_path": "$.metrics.code_quality.dependency_audit.vulnerabilities_found",
            "description": "Checked dependency_audit.vulnerabilities_found: expected >= 0, got 0",
            "confidence": 0.95,
            "raw_data": "0"
          },
          {
            "source_type": "file_check",
            "source_path": "$.metrics.code_quality.dependency_audit.tool_used",
            "description": "Checked dependency_audit.tool_used: should not be none, got none",
            "confidence": 0.85,
            "raw_data": "none"
          },
          {
            "source_type": "file_check",
            "source_path": "$.metrics.code_quality.dependency_audit.tool_used",
            "description": "Checked dependency_audit.tool_used: should not be none, got none",
            "confidence": 0.85,
            "raw_data": "none"
          },
          {
            "source_type": "file_check",
            "source_path": "$.metrics.code_quality.dependency_audit.dependency_audit.high_severity_count <= 5",
            "description": "Checked existence of dependency_audit.high_severity_count <= 5",
            "confidence": 0.9,
            "raw_data": "null"
          },
          {
            "source_type": "file_check",
            "source_path": "$.metrics",
            "description": "Criteria not satisfied for 'met' or 'partial' status",
            "confidence": 0.8,
            "raw_data": "Evaluation criteria failed"
          }
        ]
      },
      {
        "id": "code_quality_structure",
        "name": "Core Module Documentation",
        "dimension": "code_quality",
        "max_points": 7,
        "description": "README or code comments clearly mark key directories, service entry points",
        "evaluation_status": "met",
        "score": 7.0,
        "evidence_references": [
          {
            "source_type": "file_check",
            "source_path": "$.metrics.documentation.readme_present",
            "description": "Checked readme_present: expected True, got True",
            "confidence": 0.95,
            "raw_data": "True"
          },
          {
            "source_type": "file_check",
            "source_path": "$.metrics.documentation.readme_quality_score",
            "description": "Checked readme_quality_score: expected >= 0.8, got 0.8",
            "confidence": 0.95,
            "raw_data": "0.8"
          }
        ]
      },
      {
        "id": "testing_automation",
        "name": "Automated Test Execution",
        "dimension": "testing",
        "max_points": 15,
        "description": "At least one type of automated test executes and passes in CI",
        "evaluation_status": "unmet",
        "score": 0.0,
        "evidence_references": [
          {
            "source_type": "file_check",
            "source_path": "$.metrics.testing.test_execution.tests_run",
            "description": "Checked test_execution.tests_run: expected > 0, got 0",
            "confidence": 0.85,
            "raw_data": "0"
          },
          {
            "source_type": "file_check",
            "source_path": "$.metrics.testing.test_execution.tests_passed",
            "description": "Checked test_execution.tests_passed: expected > 0, got 0",
            "confidence": 0.85,
            "raw_data": "0"
          },
          {
            "source_type": "file_check",
            "source_path": "$.metrics.testing.test_execution.tests_run",
            "description": "Checked test_execution.tests_run: expected > 0, got 0",
            "confidence": 0.85,
            "raw_data": "0"
          },
          {
            "source_type": "file_check",
            "source_path": "$.metrics.testing.test_execution.tests_failed",
            "description": "Checked test_execution.tests_failed: expected > 0, got 0",
            "confidence": 0.85,
            "raw_data": "0"
          },
          {
            "source_type": "file_check",
            "source_path": "$.metrics",
            "description": "Criteria not satisfied for 'met' or 'partial' status",
            "confidence": 0.8,
            "raw_data": "Evaluation criteria failed"
          }
        ]
      },
      {
        "id": "testing_coverage",
        "name": "Coverage or Core Test Evidence",
        "dimension": "testing",
        "max_points": 10,
        "description": "Coverage >=60% or core functionality test list with execution proof",
        "evaluation_status": "unmet",
        "score": 0.0,
        "evidence_references": [
          {
            "source_type": "file_check",
            "source_path": "$.metrics.testing.coverage_report",
            "description": "Checked coverage_report: expected None, got None",
            "confidence": 0.95,
            "raw_data": "None"
          },
          {
            "source_type": "file_check",
            "source_path": "$.metrics.testing.test_execution.tests_run",
            "description": "Checked test_execution.tests_run: expected >= 5, got 0",
            "confidence": 0.85,
            "raw_data": "0"
          },
          {
            "source_type": "file_check",
            "source_path": "$.metrics",
            "description": "Criteria not satisfied for 'met' or 'partial' status",
            "confidence": 0.8,
            "raw_data": "Evaluation criteria failed"
          }
        ]
      },
      {
        "id": "testing_integration",
        "name": "Integration/Smoke Test Scripts",
        "dimension": "testing",
        "max_points": 6,
        "description": "Provides 2-3 typical scenario integration or smoke test scripts with results",
        "evaluation_status": "unmet",
        "score": 0.0,
        "evidence_references": [
          {
            "source_type": "file_check",
            "source_path": "$.metrics.testing.test_execution.framework",
            "description": "Checked test_execution.framework: should not be none, got none",
            "confidence": 0.85,
            "raw_data": "none"
          },
          {
            "source_type": "file_check",
            "source_path": "$.metrics.testing.test_execution.tests_run",
            "description": "Checked test_execution.tests_run: expected >= 3, got 0",